{
  "version": "1.0",
  "session_id": "s_123",
  "item": {
    "id": "i_456",
    "type": "mcq",
    "content": { "html": "Evaluate \\(? y = 2x^2 + 3x - 5 \\)? at \\( x = 2 \\)." },
    "media": [
      { "id": "fig1", "signed_url": "https://cdn.example/abc", "ttl_s": 120, "alt": "Quadratic diagram" }
    ]
  },
  "choices": [
    { "id": "A", "text": "9" },
    { "id": "B", "text": "11" },
    { "id": "C", "text": "13" }
  ],
  "serve": { "seed": "r8xz", "choice_order": ["B","C","A"], "watermark": "u_abc_2025-10-09" },
  "ui": { "layout": "question-above-choices", "actions": ["submit"] }
}
